,goodName,price,salesTip
0,干香菇农家特产冬菇蘑菇金钱菇干货250克500g椴木香茹农家土特产,24.21,已拼63件
1,香菇干货福建肉厚剪脚香菇100g家用包邮现货新品质量保证绿色食品,10.9,已拼105件
2,【优质精选大花菇】个大肉厚大花菇 香菇干货 干香菇 冬菇4-6cm,19.8,已拼389件
3,一斤农家土特产香菇 散装干货剪脚 西峡小香菇无脚金钱菇蘑菇500g,18.61,已拼9488件
4,干香菇碎片大片薄片干货大香菇酒店饭店包子饺子馅料食材,23.5,已拼381件
5,热销  野生椴木黑木耳东北黑木耳干货肉厚长白山秋木耳小碗耳,12.8,已拼6件
6,【大别山特级香菇】香菇干货野生蘑菇批发椴木香菇金钱菇花菇冬菇,11.88,已拼6件
7,山珍礼盒装香菇木耳野生菌干货农家河南土特产送高档年货礼盒包装,78.8,已拼4件
8,AAA特级珍珠菇NB香菇干货批发产地直供冬菇金钱菇珍珠菇低价批发,14.9,已拼18件
9,正宗四川大凉山德昌特产野生山珍新鲜蘑菇香菇野生食用菌空运包邮,93.1,已拼4件
10,顺风包邮东北鲜香菇3斤火锅食材食用菌菇可晾干应季蔬菜农家蘑菇,19.9,已拼136件
11,优选农家小花菇干货250g500g菌菇干货土特产干冬菇肉厚香菇干货,20.3,已拼17件
12,香菇干货特级小冬菇新鲜野生蘑菇土特产农家山干货特价批发干香菇,18,已拼75件
13,香菇干货一斤 西峡农家土特产 金钱菇剪脚干香菇冬菇干货批发250g,17.37,已拼2495件
14,农家种植香菇农产品花菇广西土特产天然菇类干货精选特级椴木花菇,49.8,已拼7件
15,【香信菇】庆元香菇干货 包邮 批发 冬菇花菇 农家土特产厂家直销,13.5,已拼583件
16,新店促销 香菇干货 农家土特产 精选干香菇,36.5,已拼41件
17,香菇干货 香菇 庆元香菇 庆元特产 干香菇 农家土特产 干货 新货,12.57,已拼133件
18,农家椴木花菇古田香菇干货500g金钱菇冬菇批发无根肉厚土特产100g,10.96,已拼17件
19,云南羊肚菌干货剪柄南北土特产新鲜菌煲汤用香菇野生菌羊肚菇松茸,19.2,已拼126件
20,云南土特产礼盒装1380g野生菌 鸡枞菌松茸菌牛肝菌460g香菇下饭菜,18.74,已拼1.2万件
21,得艺厨即食油焖香菇 台湾饭团用香菇碎片 开袋即食饭团材料,30,已拼66件
22,楚品源大花菇一斤农家干货特产干香菇剪脚冬菇菌菇干蘑菇新货500g,64.9,已拼2件
23,【2公斤装】干香菇丝西峡特产干香菇去脚切丝干菜类干蘑菇条批发,117.9,已拼9件
24,健康营养即食酥脆果蔬干香菇脆零食烤香菇脆片脱水蔬菜脆大袋批发,10.36,已拼3370件
25,楚品源大花菇一斤农家干货特产干香菇剪脚冬菇菌菇干蘑菇新货500g,56.8,已拼1件
26,羊肚菌干货新鲜云南特产野生菌菇月子孕妇小香菇煲汤火锅100-500g,116.8,已拼230件
27,香菇干货一斤 肉厚无根 西峡小花菇干香菇冬菇金钱菇散装批发100g,9.76,已拼3709件
28,菇耳缘房县小花菇丁干货批发香菇蘑菇正宗椴木野生香菇丁湖北特产,23.8,已拼9件
29,秦川农家椴木花菇高山原生态特级野生土特产炖肉干香菇椴木肉菇,13.89,已拼15件
30,香菇脆片500g即食蘑菇干香菇干香菇脆零食,9.9,已拼9969件
31,湖北十堰房县小花菇干货500G椴木野生小香菇冬菇干蘑菇神农架特产,83,已拼823件
32,西峡干菇腿小香菇脚双剪抛光菇脚片丁丝农产品干货10斤装包邮,114.8,已拼371件
33,买一送一剪脚羊肚菌干货野生云南野生菌非新鲜羊肚菇5克50克包邮,20.8,已拼2.1万件
34,2020年新货冬菇野生椴木蘑菇带根野生大片香菇大杯菇切丝大片冬菇,120,已拼7件
35,庆元香菇干货香信菇农家土特产食用菌菇煲汤原料散装蘑菇特级包邮,25.52,已拼138件
36,贵州特产香菇脆网红零食批发香菇干好吃健康休闲食品果蔬脆小吃,18.91,已拼15件
37,血亏特价云南新鲜野生羊肚菌干货蘑菇月子煲汤料农家香菇50g-250g,55.2,已拼1167件
38,双剪小干香菇脚湖北特产饺子包子馅料,7.9,已拼48件
39,香菇干货广西大瑶山金秀野生香菇土特产干蘑菇250g食堂餐馆食材,38,已拼81件
40,新鲜香菇干货脆小香菇干货批发西峡椴木非野生伏牛山香菇特级500g,38.8,已拼6件
41,香菇碎片商用碎香菇干货散装蘑菇冬菇包子饺子馅饭店专用5斤包邮,115.92,已拼120件
42,【北京市卖得好】大颗粒香菇酱西峡特产 拌面饭下饭香辣椒酱645g-215g,14.99,已拼10万+件
43,2020福建野生香菇干货干蘑菇肉厚剪脚根短古田菌菇批发农家土特产,23.08,已拼91件
44,农家土特产庆元香菇冬菇菌菇商用散装特级香菇干货蘑菇5斤包邮,161.5,已拼75件
45,菇耳缘正宗房县大花菇磨菇香菇湖北特产干货批发冬菇大白花花菇,33.83,总售260+件
46,纯香菇粉500g 零添加 食品调料粉增香提鲜 配料粉代替味精健康,20.7,已拼42件
47,2020年新菇 承德市香菇 干香菇 香菇干货 香菇 250g/500g,26,已拼9件
48,干香菇碎片花菇片大片无根剪脚冬菇香菇干货包子饺子 馅料,23.5,已拼156件
49,农家特产 香菇 新鲜香菇 菌菇肉厚味香火锅配菜个头饱满 现摘现发,19.8,已拼40件
50,来自大山新货 双剪小香菇脚干货特价小香菇柄花菇根冬菇腿500g,52,已拼7件
51,2019年农家香菇大片厚片干货干香菇散装包邮饺子包子馅料剪脚菇,29.78,已拼55件
52,古田农家特产干香菇丝干货蘑菇丝菌菇无脚小香菇片条切丝批发包邮,9.9,已拼616件
53,【野生大花菇】无根肉厚新货农家椴木野生香菇干货香茹蘑菇500g,35.8,已拼6315件
54,【领券减2元】网红零食菇滋菇滋香菇脆蘑菇干蔬菜脆即食香菇干,11.3,已拼1万件
55,手工香菇粉婴儿调味香菇味香无盐宝宝非婴幼儿童辅食无添加50g,20.3,已拼44件
56,野生香菇云南香格里拉椴木香菇干货野生小蘑菇香菇酱材料珍珠菇,19.8,已拼42件
57,20年新出野生特级大花菇干货500g香菇干货干蘑菇冬菇干货无根剪脚,59.9,已拼885件
58,顺风包邮东北鲜香菇火锅食材食用菌菇可晾干应季蔬菜农家湿花蘑菇,9.9,已拼106件
59,乡邻味香菇破片大片碎片香菇干货农家香菇片黄焖鸡饺子馅原料500g,28,已拼160件
